{
  "feature_id": "symbolic-egraph-saturation",
  "phase": "TESTS",
  "feature_context": "artifacts/tdd/symbolic-egraph-saturation/FEATURE.md",
  "depends_on_pr": "commit:f5b20b5",
  "module_docs": [
    "docs/modules/Symbolic.Engine.Apply.md",
    "docs/modules/Symbolic.Engine.EGraph.Rewrite.md",
    "docs/modules/Symbolic.Engine.EGraph.Saturate.md",
    "docs/modules/Symbolic.Implementation.Plan.md"
  ],
  "status": "ready",
  "updated_at": "2026-02-23"
}
